{
  "$schema": "../schemas/runtime-adapter.schema.json",
  "schema_version": "1.0.0",
  "adapter_id": "claude-code",
  "runtime_family": "anthropic-claude-code",
  "instruction_loading": {"status": "GO", "mechanism": "CLAUDE.md imports or routes to project policy.", "evidence": "official-runtime-documentation"},
  "filesystem": {"status": "CONDITIONAL", "mechanism": "Local runtime permissions and sandbox.", "evidence": "runtime-preflight-required"},
  "git": {"status": "CONDITIONAL", "mechanism": "Local Git availability and policy.", "evidence": "runtime-preflight-required"},
  "secure_github": {"status": "CONDITIONAL", "mechanism": "Normal GitHub authentication outside prompts.", "evidence": "runtime-preflight-required"},
  "persistent_storage": {"status": "CONDITIONAL", "mechanism": "Git repositories and approved local state.", "evidence": "profile-backend"},
  "background_scheduling": {"status": "UNKNOWN", "mechanism": "External scheduler evidence required.", "evidence": "not-live-verified"},
  "cross_prompt_activation": {"status": "UNKNOWN", "mechanism": "External activation evidence required.", "evidence": "not-live-verified"},
  "subagents": {"status": "CONDITIONAL", "mechanism": "Runtime subagents where available and authorized.", "evidence": "official-runtime-documentation"},
  "inbox_events": {"status": "CONDITIONAL", "mechanism": "Explicit polling or external event source.", "evidence": "profile-backend"},
  "secret_storage": {"status": "CONDITIONAL", "mechanism": "OS/provider secret store outside source and prompts.", "evidence": "deployment-specific"},
  "deployment_boundary": {"status": "NO-GO", "mechanism": "Profile adoption does not deploy services.", "evidence": "profile-policy"}
}
